{
  "created_at": "2026-10-17T12:10:00Z",
  "dependencies": [],
  "environment": {
    "image": "python:3.12-slim@sha256:0000000000000000000000000000000000000000000000000000000000000000",
    "setup": "sha256:8fb6d5f37e8055ce720bd0b1d56587f88c0071f285966ba17e72b2b12672aa73",
    "test_command": "tests/test.sh",
    "workdir": "/app"
  },
  "episode_id": "ep-f56865fef7726a42",
  "eval_id": "ev-b0c82a3ade349796",
  "family": "bug_fix",
  "instruction": "sha256:5a92f6f089f63f0d476ba2494aa0848b93dbd0bcb7f058544e10992e67f09c98",
  "manifest_version": 1,
  "override": null,
  "previous": "ev-b0c82a3ade349796@1",
  "qualification": {
    "checks": [],
    "policy": "q1"
  },
  "reasons": [
    "invalidated"
  ],
  "record": "eval",
  "reference": "sha256:a4895eb44afc336fecbba6e520cd67e178dace0276655d102fceffa8e5f70570",
  "repositories": [
    {
      "base_archive": "sha256:df584e688fb98e1977b3b09094f7173d4793507caecceceef524ef999065cad7",
      "base_tree": "sha256:6b3c784b07863cf274c287cd39fb14f478969e11a5e2e8346dea5d17039b7a82",
      "repo": "app",
      "result_tree": "sha256:ca4b52cc4b80e8eeccb7540997d015e56622e766d66f1b2b908903bf9d05338f"
    }
  ],
  "requirements": [
    {
      "checks": [
        "C1"
      ],
      "evidence": [
        {
          "record": "msg_u1",
          "source": "sha256:9e9b9c7e967fd2150f96191762001ea3f69bca1aaf5ef125ce3eb4378302a00f"
        }
      ],
      "kind": "behavior",
      "origin": "request",
      "req_id": "R1",
      "text": "sha256:82f3e9c695dc6b8d1b11818d5701919e286de8d47f7c3eb3100c485f79e57828"
    },
    {
      "checks": [
        "C2"
      ],
      "evidence": [
        {
          "record": "msg_u4",
          "source": "sha256:9e9b9c7e967fd2150f96191762001ea3f69bca1aaf5ef125ce3eb4378302a00f"
        }
      ],
      "kind": "constraint",
      "origin": "correction",
      "req_id": "R2",
      "text": "sha256:db77fd01af957221a4989b64b3770a83a3c56068405b9f0e9408feae57fd17e4"
    },
    {
      "checks": [
        "C3"
      ],
      "evidence": [],
      "kind": "preserve",
      "origin": "existing_test",
      "req_id": "R3",
      "text": "sha256:e49d63b2a8a78f048bafc4b4590029603a5a4165ee8bf98af15d62f24cd83479"
    }
  ],
  "state": "needs_review",
  "verifier": {
    "archive": "sha256:59830ebc3a4184110566bf1a290d08473dfdcbd492ce498b14cd1a5e2fa2e441",
    "checks": [
      {
        "check_id": "C1",
        "origin": "result_test"
      },
      {
        "check_id": "C2",
        "generator": {
          "inputs": [
            "sha256:db77fd01af957221a4989b64b3770a83a3c56068405b9f0e9408feae57fd17e4"
          ],
          "model": "local-coder",
          "name": "git-hint",
          "output": "sha256:9c0abe51c6e6655d81de2d044d4fb194931f058c0426c67c7285d8f5657ed64a",
          "requests": 2,
          "version": "0.2.0"
        },
        "origin": "generated"
      },
      {
        "check_id": "C3",
        "origin": "existing_test"
      }
    ]
  },
  "version": 2
}
